{"entries":[{"address":0,"analyzer_agreement":{"analyzers":["IDA","angr"],"reasons":["IDA and angr agree exactly on this function's start address and size; angr's CFGFast additionally promotes interior addresses across the binary to function starts, none of which changes any of IDA's 113 extents. Ghidra is disabled for this binary, so this is a two-analyzer check and is correspondingly less sensitive than a three-analyzer one would be","full instruction read at 0-221: diverges from our source, see reconstruction/divergences.md Finding 3, Finding 4"],"status":"agreed"},"artifacts":[],"names":["+[AppleIOPSSafeCondLock initialize]"],"reason":null,"reviewer":null,"size":222,"source_line":45,"source_path":"src/drvPortServer/PortServer.drvproj/PortServer.lksproj/AppleIOPSSafeCondLock.m","status":"control-flow-confirmed"},{"address":224,"analyzer_agreement":{"analyzers":["IDA","angr"],"reasons":["IDA and angr agree exactly on this function's start address and size; angr's CFGFast additionally promotes interior addresses across the binary to function starts, none of which changes any of IDA's 113 extents. Ghidra is disabled for this binary, so this is a two-analyzer check and is correspondingly less sensitive than a three-analyzer one would be","full instruction read at 224-250: every instruction has a counterpart in our source and no divergence was found"],"status":"agreed"},"artifacts":[],"names":["-[AppleIOPSSafeCondLock init]"],"reason":null,"reviewer":null,"size":27,"source_line":102,"source_path":"src/drvPortServer/PortServer.drvproj/PortServer.lksproj/AppleIOPSSafeCondLock.m","status":"assembly-matched"},{"address":252,"analyzer_agreement":{"analyzers":["IDA","angr"],"reasons":["IDA and angr agree exactly on this function's start address and size; angr's CFGFast additionally promotes interior addresses across the binary to function starts, none of which changes any of IDA's 113 extents. Ghidra is disabled for this binary, so this is a two-analyzer check and is correspondingly less sensitive than a three-analyzer one would be","full instruction read at 252-280: every instruction has a counterpart in our source and no divergence was found"],"status":"agreed"},"artifacts":[],"names":["-[AppleIOPSSafeCondLock initWith:]"],"reason":null,"reviewer":null,"size":29,"source_line":112,"source_path":"src/drvPortServer/PortServer.drvproj/PortServer.lksproj/AppleIOPSSafeCondLock.m","status":"assembly-matched"},{"address":284,"analyzer_agreement":{"analyzers":["IDA","angr"],"reasons":["IDA and angr agree exactly on this function's start address and size; angr's CFGFast additionally promotes interior addresses across the binary to function starts, none of which changes any of IDA's 113 extents. Ghidra is disabled for this binary, so this is a two-analyzer check and is correspondingly less sensitive than a three-analyzer one would be","full instruction read at 284-367: diverges from our source, see reconstruction/divergences.md Finding 14"],"status":"agreed"},"artifacts":[],"names":["-[AppleIOPSSafeCondLock initWith:intr:]"],"reason":null,"reviewer":null,"size":84,"source_line":124,"source_path":"src/drvPortServer/PortServer.drvproj/PortServer.lksproj/AppleIOPSSafeCondLock.m","status":"control-flow-confirmed"},{"address":368,"analyzer_agreement":{"analyzers":["IDA","angr"],"reasons":["IDA and angr agree exactly on this function's start address and size; angr's CFGFast additionally promotes interior addresses across the binary to function starts, none of which changes any of IDA's 113 extents. Ghidra is disabled for this binary, so this is a two-analyzer check and is correspondingly less sensitive than a three-analyzer one would be","full instruction read at 368-395: diverges from our source, see reconstruction/divergences.md Finding 2"],"status":"agreed"},"artifacts":[],"names":["_AIOPSSCL_interuptable"],"reason":null,"reviewer":null,"size":28,"source_line":143,"source_path":"src/drvPortServer/PortServer.drvproj/PortServer.lksproj/AppleIOPSSafeCondLock.m","status":"control-flow-confirmed"},{"address":396,"analyzer_agreement":{"analyzers":["IDA","angr"],"reasons":["IDA and angr agree exactly on this function's start address and size; angr's CFGFast additionally promotes interior addresses across the binary to function starts, none of which changes any of IDA's 113 extents. Ghidra is disabled for this binary, so this is a two-analyzer check and is correspondingly less sensitive than a three-analyzer one would be","full instruction read at 396-409: every instruction has a counterpart in our source and no divergence was found"],"status":"agreed"},"artifacts":[],"names":["-[AppleIOPSSafeCondLock interuptable]"],"reason":null,"reviewer":null,"size":14,"source_line":156,"source_path":"src/drvPortServer/PortServer.drvproj/PortServer.lksproj/AppleIOPSSafeCondLock.m","status":"assembly-matched"},{"address":412,"analyzer_agreement":{"analyzers":["IDA","angr"],"reasons":["IDA and angr agree exactly on this function's start address and size; angr's CFGFast additionally promotes interior addresses across the binary to function starts, none of which changes any of IDA's 113 extents. Ghidra is disabled for this binary, so this is a two-analyzer check and is correspondingly less sensitive than a three-analyzer one would be","full instruction read at 412-436: diverges from our source, see reconstruction/divergences.md Finding 2"],"status":"agreed"},"artifacts":[],"names":["_AIOPSSCL_condition"],"reason":null,"reviewer":null,"size":25,"source_line":165,"source_path":"src/drvPortServer/PortServer.drvproj/PortServer.lksproj/AppleIOPSSafeCondLock.m","status":"control-flow-confirmed"},{"address":440,"analyzer_agreement":{"analyzers":["IDA","angr"],"reasons":["IDA and angr agree exactly on this function's start address and size; angr's CFGFast additionally promotes interior addresses across the binary to function starts, none of which changes any of IDA's 113 extents. Ghidra is disabled for this binary, so this is a two-analyzer check and is correspondingly less sensitive than a three-analyzer one would be","full instruction read at 440-452: every instruction has a counterpart in our source and no divergence was found"],"status":"agreed"},"artifacts":[],"names":["-[AppleIOPSSafeCondLock condition]"],"reason":null,"reviewer":null,"size":13,"source_line":175,"source_path":"src/drvPortServer/PortServer.drvproj/PortServer.lksproj/AppleIOPSSafeCondLock.m","status":"assembly-matched"},{"address":456,"analyzer_agreement":{"analyzers":["IDA","angr"],"reasons":["IDA and angr agree exactly on this function's start address and size; angr's CFGFast additionally promotes interior addresses across the binary to function starts, none of which changes any of IDA's 113 extents. Ghidra is disabled for this binary, so this is a two-analyzer check and is correspondingly less sensitive than a three-analyzer one would be","full instruction read at 456-480: diverges from our source, see reconstruction/divergences.md Finding 2"],"status":"agreed"},"artifacts":[],"names":["_AIOPSSCL_setCondition"],"reason":null,"reviewer":null,"size":25,"source_line":189,"source_path":"src/drvPortServer/PortServer.drvproj/PortServer.lksproj/AppleIOPSSafeCondLock.m","status":"control-flow-confirmed"},{"address":484,"analyzer_agreement":{"analyzers":["IDA","angr"],"reasons":["IDA and angr agree exactly on this function's start address and size; angr's CFGFast additionally promotes interior addresses across the binary to function starts, none of which changes any of IDA's 113 extents. Ghidra is disabled for this binary, so this is a two-analyzer check and is correspondingly less sensitive than a three-analyzer one would be","full instruction read at 484-518: diverges from our source, see reconstruction/divergences.md Finding 1, Finding 7"],"status":"agreed"},"artifacts":[],"names":["-[AppleIOPSSafeCondLock setCondition:]"],"reason":null,"reviewer":null,"size":35,"source_line":200,"source_path":"src/drvPortServer/PortServer.drvproj/PortServer.lksproj/AppleIOPSSafeCondLock.m","status":"assembly-matched"},{"address":520,"analyzer_agreement":{"analyzers":["IDA","angr"],"reasons":["IDA and angr agree exactly on this function's start address and size; angr's CFGFast additionally promotes interior addresses across the binary to function starts, none of which changes any of IDA's 113 extents. Ghidra is disabled for this binary, so this is a two-analyzer check and is correspondingly less sensitive than a three-analyzer one would be","full instruction read at 520-560: every instruction has a counterpart in our source and no divergence was found"],"status":"agreed"},"artifacts":[],"names":["-[AppleIOPSSafeCondLock free]"],"reason":null,"reviewer":null,"size":41,"source_line":218,"source_path":"src/drvPortServer/PortServer.drvproj/PortServer.lksproj/AppleIOPSSafeCondLock.m","status":"assembly-matched"},{"address":564,"analyzer_agreement":{"analyzers":["IDA","angr"],"reasons":["IDA and angr agree exactly on this function's start address and size; angr's CFGFast additionally promotes interior addresses across the binary to function starts, none of which changes any of IDA's 113 extents. Ghidra is disabled for this binary, so this is a two-analyzer check and is correspondingly less sensitive than a three-analyzer one would be","full instruction read at 564-588: diverges from our source, see reconstruction/divergences.md Finding 2, Finding 9"],"status":"agreed"},"artifacts":[],"names":["_AIOPSSCL_unlock"],"reason":null,"reviewer":null,"size":25,"source_line":228,"source_path":"src/drvPortServer/PortServer.drvproj/PortServer.lksproj/AppleIOPSSafeCondLock.m","status":"signature-confirmed"},{"address":592,"analyzer_agreement":{"analyzers":["IDA","angr"],"reasons":["IDA and angr agree exactly on this function's start address and size; angr's CFGFast additionally promotes interior addresses across the binary to function starts, none of which changes any of IDA's 113 extents. Ghidra is disabled for this binary, so